{
  "MessageId": "1577836800000-Registry/openindustry4.com/nd/nd/nd",
  "MessageType": "ua-data",
  "PublisherId": "Registry/openindustry4.com/nd/nd/nd",
  "DataSetClassId": "d8e7b6df-42ba-448a-975a-199f59e8ffeb",
  "ReplyTo": "1577836800000-Registry/openindustry4.com/nd/nd/nd",
  "Messages": [{
      "DataSetWriterId": 3456,
      "DataSetWriterName": "openindustry4.com/nd/nd/nd",
      "SequenceNumber": 57,
      "Timestamp": "2020-01-01T00:00:00.000Z",
      "Payload": {
        "Health": "NORMAL_0",
        "HealthScore": 100
      }
    }
  ]
}
