{
  "MessageId": "1639693510094-Registry/openindustry4.com/nd/nd/nd",
  "MessageType": "ua-data",
  "PublisherId": "Registry/openindustry4.com/nd/nd/nd",
  "ReplyTo": "1639693510000-Registry/openindustry4.com/nd/nd/nd",
  "Messages": [{
      "DataSetWriterId": 93,
      "WriterGroupName": "oee",
      "DataSetWriterName": "openindustry4.com/nd/nd/nd",
      "SequenceNumber": 3985,
      "Timestamp": "2021-12-16T22:25:10.094Z",
      "Payload": {
        "availability": 90,
        "performanceRate": 95,
        "qualityRate": 98,
        "product": 84
      }
    }
  ]
}
