{
  "MessageId": "1639693510094-Registry/openindustry4.com/nd/nd/nd",
  "MessageType": "ua-data",
  "PublisherId": "Registry/openindustry4.com/nd/nd/nd",
  "DataSetClassId": "543ae05e-b6d9-4161-a0a3-350a0fac5976",
  "ReplyTo": "1639693510000-Registry/openindustry4.com/nd/nd/nd",
  "Messages": [
    {
      "DataSetWriterId": 623,
      "WriterGroupName": "Status/Good",
      "DataSetWriterName": "openindustry4.com/nd/nd/nd",
      "SequenceNumber": 14,
      "Timestamp": "2021-12-16T22:25:10.094Z",
      "Payload": {
        "Number": 0,
        "Description": "The operation succeeded.",
        "Category": "CAT_STATUS_1",
        "Details": {
          "SymbolicId": "Good"
        }
      }
    }
  ]
}
