{
  "MessageId": "1639693510094-OTConnector/provider.com/FieldDataService/FDS-001/1200-0345",
  "MessageType": "ua-data",
  "PublisherId": "OTConnector/provider.com/FieldDataService/FDS-001/1200-0345",
  "DataSetClassId": "360ca8f3-5e66-42a2-8f10-9cdf45f4bf58",
  "ReplyTo": "1639693510000-ITConnector/consumer.com/MEService/MES%2fOnPrem/Inst07322",
  "Messages": [
    {
      "DataSetWriterId": 1,
      "DataSetWriterName": "provider.com/FieldDataService/FDS-001/1200-0345",
      "SequenceNumber": 4,
      "Timestamp": "2021-12-16T22:25:10.094Z",
      "Payload": {
        "Manufacturer": {
          "Locale": "en-US",
          "Text": "Provider Ltd."
        },
        "ManufacturerUri": "provider.com",
        "Model": {
          "Locale": "en-US",
          "Text": "FieldDataService"
        },
        "ProductCode": "FDS-001",
        "HardwareRevision": "",
        "SoftwareRevision": "1.0.1",
        "DeviceRevision": "",
        "DeviceManual": "https://provider.com/manuals/FDS-001.pdf",
        "DeviceClass": "OI4.OTConnector",
        "SerialNumber": "1200-0345",
        "ProductInstanceUri": "provider.com/FieldDataService/FDS-001/1200-0345",
        "RevisionCounter": 1,
        "Description": {
          "Locale": "en-US",
          "Text": "This OT connector provides field data"
        }
      }
    }
  ]
}
