{
  "MessageId": "1639693510094-Registry/openindustry4.com/nd/nd/nd",
  "MessageType": "ua-data",
  "PublisherId": "Registry/openindustry4.com/nd/nd/nd",
  "DataSetClassId": "9d5983db-440d-4474-9fd7-1cd7a6c8b6c2",
  "ReplyTo": "1639693510000-Registry/openindustry4.com/nd/nd/nd",
  "Messages": [
    {
      "DataSetWriterId": 42,
      "WriterGroupName": "Network%20settings",
      "DataSetWriterName": "openindustry4.com/nd/nd/nd",
      "Timestamp": "2021-12-16T22:25:10.094Z",
      "Payload": {
        "network": {
          "Name": {
            "Locale": "en-US",
            "Text": "Network"
          },
          "Description": {
            "Locale": "en-US",
            "Text": "Describes the network configuration of this service"
          },
          "ip_address": {
            "Description": {
              "Locale": "en-US",
              "Text": "IP address of Network DNS server"
            },
            "Name": {
              "Locale": "en-US",
              "Text": "IP Address"
            },
            "Type": "String",
            "Validation": {
              "Pattern": "^(?:(?:25[0-5]|2[0-4][0-9]|[01]?[0-9][0-9]?)\\.){3}(?:25[0-5]|2[0-4][0-9]|[01]?[0-9][0-9]?)$"
            },
            "Value": ""
          },
          "subnet-mask": {
            "Description": {
              "Locale": "en-US",
              "Text": "Subnetmask of Network"
            },
            "Name": {
              "Locale": "en-US",
              "Text": "Subnetmask"
            },
            "Type": "String",
            "Validation": {
              "Pattern": "^(((255\\.){3}(255|254|252|248|240|224|192|128|0+))|((255\\.){2}(255|254|252|248|240|224|192|128|0+)\\.0)|((255\\.)(255|254|252|248|240|224|192|128|0+)(\\.0+){2})|((255|254|252|248|240|224|192|128|0+)(\\.0+){3}))$"
            },
            "Value": ""
          },
          "port": {
            "DefaultValue": "80",
            "Mandatory": false,
            "Name": {
              "Locale": "en-US",
              "Text": "Port"
            },
            "Type": "Number",
            "Validation": {
              "Min": 0,
              "Max": 65535
            },
            "Value": ""
          }
        },
        "Context": {
          "Name": {
            "Locale": "en-US",
            "Text": "Network settings"
          },
          "Description": {
            "Locale": "en-US",
            "Text": "Settings of all network interfaces"
          }
        }
      }
    }
  ]
}