{
  "MessageId": "1577836800000-Registry/openindustry4.com/nd/nd/nd",
  "MessageType": "ua-data",
  "PublisherId": "Registry/openindustry4.com/nd/nd/nd",
  "DataSetClassId": "27a75019-164a-496d-a38b-90e8a55c2cfa",
  "ReplyTo": "1577836800000-Registry/openindustry4.com/nd/nd/nd",
  "Messages": [{
      "DataSetWriterId": 489,
      "WriterGroupName": "room_206",
      "DataSetWriterName": "openindustry4.com/nd/nd/nd",
      "SequenceNumber": 17,
      "Timestamp": "2020-01-01T00:00:00.000Z",
      "Payload": {
        "Location": {
          "Value": "room_206",
          "Local": "Room 206",
          "Parent": {
            "Value": "floor_2",
            "Local": "Floor 2",
            "Oi4Identifier": "provider.com/FieldDataService/FDS-001/1200-0345"
          }
        }
      }
    }
  ]
}
